attraction,country,review,score,trip_date
Egeskov Castle,Denmark,"Lovely place. Can spend a day or more, they have so much to do.
This is a pleasant hybrid between a castle, automobile museum, theme / activity park.",5.0,Jun 2021
Egeskov Castle,Denmark,"What a great day here!!
The castle: beautiful from the outside, impressive from the inside.
Gardens: well kept, full of picturesque flower arrangements.
Exhibitions: absolutely cool stuff for kids and adults.
Playgrounds: it was almost impossible to remove the kids, there is stuff to do and climb for every age. One of the best playgrounds ever in a most beautiful setting.
All over, it was a perfect day. The seven year old said it was even better than Legoland",5.0,Jun 2021
The Black Diamond - Royal Danish Library,Denmark,Fascinating piece of architecture. Unfortunaly did not have time to go inside. It is right on tje coast. You have a great view during boat ride. Go visit.,5.0,Aug 2021
Lindholm Hoeje Museum,Denmark,"Highlight of my trip to Aalborg and well worth the trek across half of Jutland to get there.
The Lindholm Hoeje Museum is on the site of Viking Burial tombs and houses discovered under sand dunes on a shooting range in the 1950's.
The museum itself has a small cafe and shop with two exhibitions. One on the vikings in the area and the other on geology and wildlife.
The staff in the museum were knowledgeable friendly, helpful (looking after my bag) and even booked a taxi at the end of the day.
The highlight were the ruins outside. A peaceful windswept hill, with burial chamber remains of granite boulders and houses.
A truly special site!
Read more",5.0,Sep 2021
