country,attraction,score,review,trip_date
Germany,The Dresden Zwinger,5.0,Lovely buildings with great character. Great to see the building being restored back to its firmer glory. Great access to most areas of the grounds and balconies also with some lovely views.,Sep 2021
Germany,The Dresden Zwinger,3.0,"It’s big and nice to walk around, but not at this time - first of all - half of it is being renovated currently and also due to that there are some dead ends, so we had to walk back about 10 minutes to get off the walls. Best to wait until renovation is done and visit other landmarks.",Sep 2021
Germany,The Dresden Zwinger,5.0,"We visited the building complex and found countless of wonderful details as well as stellar places for photography. Would recommend to anyone coming to Dresden, especially since you can access all the outdoor areas for free. Special mention of the possibility to walk on top of the walls as from there you can see some gorgeous details of the design up close!",Sep 2021
Germany,The Dresden Zwinger,4.0,"So, went there with my wife. The building looks great but it is only approx. 70 years old. The art is fine and prices are mid range.",Sep 2021
Germany,The Dresden Zwinger,3.0,"Very nice area just to walk around in, or sit and enjoy the atmosphere. It’s just 10 minutes walking distance from Frauenkirche.",Jul 2021
Germany,The Dresden Zwinger,4.0,"Amazing time since the place was all but empty. Only local tourists it seems made it due to Covid. Using, in July, European countries are jam packed w tourists, but now is THE PERFECT time to travel
The sites were beautiful. But sadly so many parts of it was under construction. But we’ll worth the visit. Stay for the sunset and cross the bridge to take some good pictures. BUT DO NOT EAT around there as prices were high and service was terrible.",Jul 2021
Germany,The Dresden Zwinger,5.0,"Learn about the history and understand the times! This is a fine place to walk and visit. Great architecture. The royals had it all! Thanks to the “Whit Gold” ( porcelain)
The artists created such wonderful work! A must see place!",May 2021
Germany,The Dresden Zwinger,5.0,It's a must see in Dresden. You can find there many of classic buildings from the royal time. It's really beautiful!,Jun 2021
