country,attraction,score,review,trip_date
UK,Arthur's Seat,5.0,"Great place to visit when in Edinburgh if the weather is good. Not a long walk up but quite steep, gravelly and hard in places. Well worth the effort. The countryside around Arthur’s Seat is great too.",Sep 2021
UK,Arthur's Seat,5.0,"If you want a place to get a proper bird's eye view of the whole of Edinburgh, Arthur's Seat is the place to be. It's a couple of hours trek from the city. We started from old town, went to Hollyrood Palace and from there, walked up to this place.",Aug 2021
UK,Arthur's Seat,5.0,"A bit hard tips: (use google maps while going up mountain) super fun #Arthursseat

Have an amazing time.",Aug 2021
UK,Arthur's Seat,5.0,"If you are reasonably fit, climbing to the summit of Arthur's Seat is easily achievable. The easier side is from Willowbrae rather than Hollyrood side which is far steeper, but easier to access from the centre of Edinburgh. Excellent views from the summit particularly on a sunny day at sunset.",Aug 2021
UK,Arthur's Seat,5.0,"If you want a panoramic view of a stunning city head up to the top.

The Radical Road is currently off limits due to unsafe structure of rock yet there are other paths.

Wear hiking boots as where the terrain steepens it’s loose rock and a bit perilous.",Aug 2021
UK,Arthur's Seat,5.0,Fantastic views from the top and a lovely little walk up around the lock and past the ruins of an old chapel. Should be relatively easy to get up and down in an hour or so for anyone with any level of fitness.,Aug 2021
UK,Arthur's Seat,5.0,"This is by no means a breezy jaunt up gentle slopes ! For those enjoying a Free Bus Pass wear strong trainers with good ankle support and take water as well as your time ! Nevertheless, it is a wonderful experience - you will have plenty of company and it is a rocky scrabble towards the end- you have been warned. I was not the only one clutching on to the chain rail and sometimes resorting to all fours ! Wonderful views at the top ! I would have appreciated a bit more information at the top on the surrounding panorama! But, so pleased I did it - despite seemingly being the oldest person around !",Aug 2021
UK,Arthur's Seat,5.0,We hiked up to the summit which took us 30 minutes. It is quite rocky so I would recommend wearing good shoes. We got to the top and before I could even take in the view my partner was on one knee! It was the perfect spot for a proposal with stunning views over the city. A lovely place to pop the question if anyone else is considering it! :),Aug 2021
UK,Arthur's Seat,4.0,This is quite a steep climb in places and it is narrow at the top and slippery. It is worth it to see the views - but it was misty on the day we went so couldn't see a thing! It was still really packed and busy so I would recommend going early/late to avoid the huge crowds.,Aug 2021
UK,Arthur's Seat,5.0,"Having planned a city break, my wife, daughter and I were astounded to find the beautiful area of mountainous countryside within a few minutes walking distance of our guest house. Lovely views over Edinburgh and Leith, lovely fresh air and lots of established paths to explore. Breathtaking!",Aug 2021
UK,Arthur's Seat,5.0,Beautiful views of the city. Worth the climb. There are various routes up and I have never done the same one twice. Some are easier than others.,Aug 2021
UK,Arthur's Seat,5.0,Came upon this by accident. At first both children protested about climbing all the way to the top. Now both of them feel it was one of the highlights of there holiday. Definitely on the to do list for next time we visit.,Aug 2021
UK,Arthur's Seat,4.0,"This was an amazing walk and a great experience. 100% worth it. When you reach the top the views are absolutely incredible and surreal. You can see the whole city and it’s absolutely amazing. However, I believe you need more preparation than people are made to think. As an experienced climber who has have climbed Pen-y-Ghent and other mountains and completed various hikes I would advise for people looking to go all the way to the top ,as shown in my pictures attached, to wear appropriate clothing and hiking boots or gripped shoes as it’s very steep and rocky. When you get to the summit, you have to scramble and use your hands to climb so I wouldn’t recommend this to anyone is elderly or who will find this difficult and struggle. Overall it’s a really great experience and such a great experience for anyone and everyone who visits.
Read more",Aug 2021
UK,Arthur's Seat,5.0,"We really enjoyed this walk, great sights of the city and the sea! It can be as easy or as difficult as you want as you can hike or walk on flat so perfect for people who may not be as able to walk uphill.",Aug 2021
UK,Arthur's Seat,5.0,"Amazing views at the top. Worth the hike and is a good source of exercise. Really enjoyed it, one of the highlights of Edinburgh.",Aug 2021
UK,Arthur's Seat,5.0,"Amazing place to visit. If come to Edinburgh you definetly need to go to Arthur's Seat. You can see almost all Edinburgh from there. Don't forget to bring your water and prepare to walk, because it is very high.",Aug 2021
UK,Arthur's Seat,5.0,"iconic and not to be missed, we also did the other two smaller peaks, go for it if you have the opportunity",Aug 2021
UK,Arthur's Seat,5.0,"My favourite thing about Arthur's Seat is reading the 1 star reviews on Tripadvisor about people who complain there was no seat and no view! :'-)
My second favourite thing was the view and lack of seats!

There are many hundreds of combinations of routes to get to the top and back down. Therefore there are many levels of difficulty. I went a short and direct route up from Ulster Crescent (see photo) after a walk from the beach. I parted ways with the less enthusiastic wife and daughter just past the lock (yellow circle on photo) allowing them to walk a flat bypass around the mountain where I met them on the other side. The way down I left to gravity and my feet.

The views on the top were amazing. I think our 1 star friends are people expect things that are far away to be close or simply don't appreciate that there isn't a city in the world with a unspoilt volcano in the middle of it that allows you to see 90% of it.

Find the right route for you and enjoy this breathtaking, natural, unspoilt, FREE experience.
Read more",Aug 2021
UK,Arthur's Seat,4.0,This is a great day out especially if the weather is good. We parked at the base of the seat (had to pay) and the took a gentle walk towards the top. At some point you have to go “more vertical” and exert a bit more energy but it’s genuinely no more than moderate exercise and trainers are fine versus walking boots. The conditions were excellent when we went. At the top there are the most spectacular views (and a lot of flies!),Aug 2021
UK,Arthur's Seat,3.0,Be prepared to wear good shoes. I wore conserve and this was a mistake. We went the day after it was raining and it was very slippery. I saw two people fall over. When we got to top unfortunately it was just clouds. It was a personal achievement to climb to the top and get to the bottom without breaking anything. If you want great views without the risk book Edinburgh castle tickets.,Aug 2021
UK,Arthur's Seat,5.0,This mountain walk is situated in Holyrood Park and takes approximately 45 mins to get up to the top and approximately 30 mins down. Wear appropriate footwear as well as ensure you carry a water bottle. We went on a sunny day and the views were stunning. It can get crowded on the top especially as there is no clear cut footpath the further up you go.,Jul 2021
UK,Arthur's Seat,5.0,Awesome view and well worth the climb. But you can cheat by driving up and parking near the Arthur's Seat if you want to miss out on the climb.,Aug 2021
UK,Arthur's Seat,5.0,Can't say much about the views as it was pouing with rain - but we had a great time climbing up Arthur's Seat. It's a fairly easy climb - even in a torrential downpour - would highly recommend it.,Aug 2021
UK,Arthur's Seat,5.0,"An absolute must for anyone visiting Edinburgh. We were so lucky that the weather was so good, which made the view at the top even more stunning. Although it is a little bit of a walk up, it is definitely worth it! Breathtaking views of Edinburgh and the surrounding areas from the top!",Aug 2021
UK,Arthur's Seat,5.0,"It was an enjoyable walk up the hill, and the views from the top were simply stunning! Definitely worth doing, but wear sensible shoes as some bits are steep and dirty.",Aug 2021
UK,Arthur's Seat,5.0,"What a gem to have on the edge of your city! The hill looks great from below, but after a medium difficulty 45 minutes climb, the views over the city and the Firth of Forth are spectacular. The most popular route very crowded the day we went, but there are plenty of other paths. Be aware that much of the climb is on rock, which can be slippery when wet. Suitable footwear is a must!",Aug 2021
UK,Arthur's Seat,5.0,It's worth it. If you're really an adventurous and want to explore and see the view of edinburgh then this is the place for you.,Aug 2021
UK,Arthur's Seat,5.0,"This is something that worth doing while in Edinburgh! It takes a good 40min up way and another 20min down way. The view is stunning, seeing Edinburgh from a different point! There are toilets next to the Education centre (close @ 5pm on Tuesdays). Get some water and prepare for windy conditions even on a sunny day!",Aug 2021
UK,Arthur's Seat,5.0,"There are various routes to the top, some easier than others, well worth the effort for the glorious panoramic views, not only from the top but from different stages of the climb.",Aug 2021
UK,Arthur's Seat,5.0,"Been to Ediburgh numerous times and Arthurs seat has always been a place we have wanted to climb and see but the opportunity never arose. This year however we decided it would be walked. as others have put it is a climb and the path maybe a little slippy especially at the top if wet but we were blessed by a good day. Took us 25 mins from bottom to top at a steady pace but is quite steep and scramble at the top.
The views agreat and well worth the climb.",Aug 2021
UK,Arthur's Seat,5.0,"When visiting Edinburgh, we decided to go up Arthur's seat, it was a little bit exhausting to climb up but not too bad. Can also see the ruins of an old chapel and stunning views over Edinburgh and some lakes.
It's definitely worth it",Aug 2021
UK,Arthur's Seat,5.0,"Don't be lazy and climb the short way :)
There are a few ramps of stone steps, but the view on a fair day is well worthy of the effort.",Aug 2021
UK,Arthur's Seat,5.0,"I didn't expect such a hard climb but you can walk up an easier route mostly to the top, by following the road (we came back that way, much more pleasant for me as my knees aren't great)",Aug 2021
UK,Arthur's Seat,5.0,"Tough going but well worth the effect when you reach the top. The views of the city are fantastic. Wouldn’t like to do it when wet as the stones at the top are so smooth, it a bit like ice.",Aug 2021
UK,Arthur's Seat,5.0,This has been on my Edinburgh To Do list for several years but we have never managed to fit it into our itinerary. This time we had a window and the weather was perfect. Set off up the gentle path climbing up behind Dynamic Earth and things didn’t look too taxing. Then rounded the corner to see the full task ahead of us…much higher/steeper than anticipated however it wasn’t actually that bad with several stops en route to catch our breath. You just had to watch your step as the ground is rather uneven. The arrival at the top markers rewards you with the most stunning views of the city and surrounding water. Really beautiful and well worth the climb.,Aug 2021
UK,Arthur's Seat,5.0,"The hike up provided great views of the city and surroundings. The walk up is not difficult. Depending on which path you take, it can be a little narrow in places but nothing too awkward. Great activity on a nice day!",Aug 2021
UK,Arthur's Seat,5.0,"There are two ways to do it, one steeper from south side and one less steep from north side. Great view from the top and a fun hike.",Aug 2021
UK,Arthur's Seat,4.0,AmazIng to think this hill is so close to the city centre! A very steep path leads the way up to the peak which offers spectacular views over Edinburgh and beyond. Worth it but is a hard walk best done in walking boots.,Aug 2021
UK,Arthur's Seat,5.0,We took about 45mins to get up but I'm really unfit and we stopped briefly a few times. It's tough going in places and a bit of a scramble over rocks at the top but the views of Edinburgh are fantastic. Trainers should be fine for climbing but good walking boots make things easier. We picked a day with good weather and had lunch on the Royal Mile once we'd finished. The car park just round the corner from The Palace of Holyrood is £1/hour and had plenty of spaces when we arrived at 10am (Tuesday). It was however VERY busy when we got back down.,Aug 2021
UK,Arthur's Seat,5.0,If planning to go up here make sure you wrap up warm. The wind is pretty chilly especially at the highest point (no matter how nice the sun is) Additionally make sure you take lots of water :-),Aug 2021
UK,Arthur's Seat,5.0,Took about 30 mins to get to the top and the fog had really closed in but we waited about 20 mins and could see EVERYTHING. We also met a local about 3/4 of the way up who gave us an insight into what we were seeing. Lesson here - don't be afraid to ask others about the views - it added a lot to our experience,Aug 2021
UK,Arthur's Seat,5.0,"Climbed this lovely little hill early morning. Only 30 minute walk, but for some short stretches I could have been in the Highlands. Fantastic views of the city from the top. Highly recommend.",Aug 2021
UK,Arthur's Seat,5.0,"Lucky with the weather, a fantastic walk resulting in amazing views. Hard work in places, but definitely worth it.",Aug 2021
UK,Arthur's Seat,5.0,"This is a must do if you visit Edinburgh.
Amazing views of the city! It is not too difficult to climb with various paths up, definitely worth the climb👌🏼.",Jul 2021
UK,Arthur's Seat,5.0,"Really , really good !!!!. Must see spot !!! Great views .. it’s well worth it I promise !!!! Quite a challenging walk as well? Must be fit",Aug 2021
UK,Arthur's Seat,5.0,"My friends and I made the climb and had a lot of fun. Not so difficult a novice would find it impossible, there were lots of path variations to appeal to all walkers of different experiences.

The views from the top are stunning, and there is plenty of room on the summit to rest and take it all in before you make the descent!",Aug 2021
UK,Arthur's Seat,5.0,"It was a bit more of a climb than we were expecting but well worth it, loved the view but we were very lucky to have a really clear day. Definitely need to some decent boots or shoes",Aug 2021
UK,Arthur's Seat,5.0,A challenging walk to the top but well worth it. Several routes to choose from that some can be quite an effort.,Aug 2021
UK,Arthur's Seat,5.0,"Tuesdays, Wednesdays and Thursdays you can only drive up halfway and park at the free carpark and do the easy route up Arthurs seat. A barrier is put in place to stop cars on the other days.
Mind you the other carpark close to Holyrood Palace is free too at weekends only. And the second easy route is from the lake through the trees.
Extremely slippery on a wet misty day. I lost my balance several time and slipped and fell once.
Believe me it is not as easy as some reviews state here when the ground is wet.
A que even on the most dismal day for a picture at the summit.
Thing with this walk is the weather changes so quickly, pack a waterproof and a woolley hat, you won't regret it. Oh and something to eat to give you energy halfway!
Read more",Aug 2021
UK,Arthur's Seat,5.0,"Similarly to Calton Hill, we were told about this by a family member and suggested it would be a great chance to experience something outside and get in some more great views of the area.

I'm not afraid to say that I struggled a little on the way up with a lot of uneven terrain and crumbly steps but persevered because I really wanted to check out the views at the top. I'm not the fittest of people and when google described it was being "" slightly strenuous"" I was surprised that I found it as hard as I did but I'm proud of myself for doing it. I wasn't expecting to see so many little kids doing the walk up but I guess they are pretty fearless compared to me! At the very top there is a white pillar which had unfortunately had graffiti on it which is such a shame as the surrounding area is full of nature. I was surprised to see quite a lot of broken glass on the way too which is a harsh reminder of how horrible some humans can be.

Without a doubt the views were great at the top, and it was good to be able to say I'd done it but was definitely pleased when I was back on even ground again! The walk down was a bit easier than the way up but would definitely recommend trainers or good walking shoes as everything is quite uneven and saw a few people take a tumble at some points. On the way back down it had started to rain so was pleased that we went up when it was dry even though it was a bit more windy that I'd have liked but the rain didn't seem to put off many people and it was becoming fairly busy.

If you like walking, and you're okay with uneven terrain I would definitely recommend coming up to Arthur's Seat as it offers the best views of the city. I wouldn't have liked to have done this on my own, so i was very grateful to have my boyfriend there to help me up along the way!
Read more",Aug 2021
UK,Arthur's Seat,5.0,Recently visited Edinburgh for the first time & thought we’d do this climb on a sunny day. We’re pretty fit & found the climb a challenge but manageable- trainers or decent foot ware is essential! Took us about an hour to get to the top but was worth every minute…breath taking views!,Aug 2021
UK,Arthur's Seat,5.0,I loved Arthur’s seat! Great views of the city but don’t forget to bring a drink. The path was steep and dusty but we were rewarded with the fabulous view.,Aug 2021
UK,Arthur's Seat,5.0,"Amazing views and it free, great sights across the city, fair climb for a lot of people, take water and you will be rewarded",Jul 2021
UK,Arthur's Seat,5.0,One of my favourites is when I need to relax in Edinburgh. Has wonderful view of all Edinburgh and great location for activities,Jul 2021
UK,Arthur's Seat,5.0,Lovely walk up to start the day. Managed to time it well and have a really good clear view all around with no cloud or mist.,Aug 2021
UK,Arthur's Seat,5.0,Walk up the beautiful mountain and reap the rewards at the top. Stunning scenery of a wonderful city.,Jul 2021
UK,Arthur's Seat,5.0,"Was lucky enough to be in Edinburgh on a sunny day (say what?), took it slow to get all the way up to the top but the views are splendid. A nice workout to get all the whisky from the night before out of your system.",Jul 2021
UK,Arthur's Seat,5.0,Amazing views. Not too tiring. We went up the red route which wasn’t too strenuous. Well worth the hike up for the amazing views.,Jul 2021
UK,Arthur's Seat,5.0,Went up the purple route from Holyrood Park Road entrance and down to the place car park. Got to the top about 10 was getting busy as I came down. Great views despite cloudy weather,Jul 2021
UK,Arthur's Seat,5.0,"A must do if you like walking.

We set off early, did struggle a little bit to find Scottish Parliament as a starting point but once we did we following the main path and following the sign for The Summit. It was quite a steep walk all the way, and rocky/dusty underfoot so wear appropriate footwear.

Climb to the summit using this route was approx 30-40mins and very worth it for the 360° views at the top. Amazing! Just beware there’s a lot of flies at the top to share either experience.

Descent back to the bottom was easy and calm. Depending on your fitness allow 60-120 minutes for the journey.
Read more",Jul 2021
UK,Arthur's Seat,5.0,"We followed a path on the app all AllTrails which took us on a route that was less busy than the main route. Took us about two hours to complete. Worth it for the views. Definitely wear sensible shoes - saw some people in flip flops - not sure how they managed.

We finished the walk with a trip to Bellfield Brewery which I would 100% recommend as a way of finishing the walk!",Jul 2021
UK,Arthur's Seat,5.0,Not as easy as yo'd think to get to the top. Make sure you allow 2 hours for this to go up to the top and come back down. It is a fun hike/walk and there are usually lots of other people around too. There are some tricky parts right at the top which might be a challenge for anyone who struggles with climbing and incline,Jul 2021
UK,Arthur's Seat,4.0,The views from the top of Arthur’s Seat are stunning however this is not an easy walk whichever route you take. The summit section is both gravel and well worn granite so can be very slippery if you don’t have appropriate footwear. This is certainly not a walk for sandals or flip flops. There are some dangerous areas at the top so children need to be very careful.,Jun 2021
UK,Arthur's Seat,5.0,"Lovely walk up to the top, with beautiful views over Edinburgh. Took about 45 minutes at a moderate pace so not too strenuous. Well worth it.",Jul 2021
UK,Arthur's Seat,5.0,"We are so glad we walked to the top of Arthur's seat, the weather was fabulous, the walk is pretty tough we walked about 5 miles in all but the view of Edinburgh was worth it, fantastic day worth the sweat, wear sensible shoes can be slippery, but do it if in town, so worth it.",Jul 2021
UK,Arthur's Seat,5.0,"Took about 40 minutes to get to the top, with the path getting more difficult at the very top, but the views were definitely worth it!",Jul 2021
UK,Arthur's Seat,5.0,"Breathtaking views of the city available from up here and a really fun climb with plenty of different routes and terrains.

It took us around 40 minutes to reach the peak using one of the most-trodden paths and around 30 to climb back down.",Jul 2021
UK,Arthur's Seat,5.0,"Arthurs seat was my favorite part of Edinburgh, with awesome views across the city. Arturs seat is also reasonably easy walk up which means it's accessible for most people.",Jul 2021
UK,Arthur's Seat,5.0,"A fantastic couple of hours walking and sight seeing. A busty place, Holyrood Park is a must see, in thesun.",Jul 2021
UK,Arthur's Seat,5.0,"Always wanted to walk up Arthur’s Seat when at Edinburgh, great day, nice walk with great views!!! Took the back route rather than the more popular path, steeper but more enjoyable",Jun 2021
UK,Arthur's Seat,5.0,"Great way to stretch you legs and get out of the city for a few hours.
Only a short walk from the city and after a challenging 30/40 min steep climb,its worth it for the views at the top.
Definitely need to wear suitable footwear (and clothing!)",Jul 2021
UK,Arthur's Seat,5.0,absolute must for any Edinburgh trip and not too much of a long walk so even those who aren’t fans of walking should try.,Jul 2021
UK,Arthur's Seat,4.0,"Pleasant walk close to City Centre giving amazing views over Edinburgh.

The route we took was moderately challenging but if you have more time (and inclination) there are longer less steep routes.",Jul 2021
UK,Arthur's Seat,5.0,"Highly recommend climbing to the top of Arthur's Seat - especially on a clear day.

It does get quite busy when the weather is good.",Jun 2021
UK,Arthur's Seat,5.0,"One of the must thing to do in Edinburgh for free. It should take 2-3 hours at your own pace. Watch out for the weather and plan for sunny day and it will be amazing experience. Take a small water bottle will do, hiking shoe will better but normal running shoe will be fine.",Jun 2021
UK,Arthur's Seat,5.0,"If you like trail-walking and the weather is nice in Edinburgh, definitely go to this place! The walk to the summit can take between 30 minutes to 1 hour depending on the route that you chose (and your speed). But once you're up there, it's totally worth it! The view is really stunning and you can see the whole Edinburgh and it's surrounding area.",Jul 2021
UK,Arthur's Seat,5.0,"We climbed to the top of Arthur’s Seat on a a sunny day in July. We left quite early to try and beat the heat of the day - worth doing as you are obviously quite exposed. The walk from start to the very top took us about 30-45 minutes at a slow pace to best enjoy the views! Worth stopping at the Holyrood Park Education Centre (behind the palace) before you begin the walk to use the facilities there as no toilets in the park/climb itself. On Google the centre shows as closed, but the public toilets remain open during the day.
The view at the top is stunning and totally worth the effort of the climb!",Jun 2021
UK,Arthur's Seat,5.0,"So when you stand at the bottom, you think it'll be easy to get to the top... Then you start climbing and winding through the most 'path' like routes. Hard work to get to the top, but we have no regrets, the view was amazing and you have a sense of achievement once you've made it!",Jul 2021
UK,Arthur's Seat,5.0,"If you can, then do take the time to walk up here. The views are worth it, and it helps build your appetite for the next meal! The path is largely straight forward until the rocky top where it is a bit tougher if you have mobility problems. It is incredible to see just how big the park is and even if not up to climbing it is a great open space in the middle of a city.",Jul 2021
UK,Arthur's Seat,5.0,Takes about 30 minutes or so. Tough paths so use good footwear! I saw a woman climb it in slippers but that’s not ideal.,Jul 2021
UK,Arthur's Seat,5.0,Easy to moderate walk with satisfying city views at the end. It's not a difficult walk and could be done in trainers but hiking shoes / boots are better,Jun 2021
