country,attraction,score,review,trip_date
UK,Tower of London,5.0,"Thoroughly enjoyed our visit to the Tower of London. Visited at 12 midday, last week of July and I expected it to be very busy but it wasn't perhaps due to the pandemic and minimum tourists so it made the visit more pleasant. So glad the yeoman warder tour was back on,big shout out to 'Shady' who was informative and fun bringing all its history to life. Would recommend hiring an audio guide for adults & older kids as you walk through each section of the tower for £5 each. Spent around 3 hours here, well worth it.",Jul 2021
UK,Tower of London,5.0,"We went on the last Beefeater tour of the day with Yeomen Scott Kelly #Beefy409 on 29th July 2021.

What an amazing time we had...
Yeomen Scott Kelly entertained the crowds with lots of information about the Tower's history by getting all the crowd involved in cheering and shouting when needed, he even checked that the children amongst the group were happy to hear all about the blood & gore. The enthusiasm he had throughout the tour while giving you the information made you want to continue the tour and were able to gain more knowledge as it's done in a fun way.
At the end of the tour there was the opportunity to ask questions and take photos, you can see by his smile that it's a genuine smile and that he really loves his job!
We had such as amazing time and could not recommend this tour enough.
Read more",Jul 2021
UK,Tower of London,5.0,"What a joy, the history of the Tower was brilliantly represented by the well-organised tour, exhibits and signposting. Despite some iffy weather our yeoman guide (Basher) was highly engaging, bringing history life for all ages. The contrast with the miserable representatives of Westminster Abbey we had just visited could not have been more stark. No wonder the Tower is rated #1. Ps hurry while there are no queues for the Crown Jewels!",Jun 2021
UK,Tower of London,5.0,"Worth every penny of the ticket price.
My suggestion would be to get there early while it's quiet and take some photos and have a leisurely look around, before joining a beefeater tour, which are informative and amusing.",Jul 2021
UK,Tower of London,5.0,"Amazing-really great beefeater who gave us an informative tour.
Something here for everyone-. Children nd adults. Worth every penny of the visit. Thanks",Jul 2021
UK,Tower of London,5.0,"Scott Kelly was great, best tour guide. He was absolutely amazing. So fun and including for the whole family! He was so entertaining and fun! I would recommend!",Jul 2021
UK,Tower of London,4.0,"It’s the Tower of London, so it’s something with a unique history that’s got to be seen at some point if you’re British. The history speaks for itself and would be worth 5 stars so this is more about the way it’s displayed and managed.

It was an ok and pretty good experience, however I would have preferred more displays about the people who used the tower (to imprison and be imprisoned) and less about the wider context of war and weapons. For example I couldn’t find anything about Mary Queen of Scots despite her being a prisoner there.

The beefeaters and ravens were very friendly/engaging and helped to make it a more interactive experience.

Given I’d paid £30 for one adult and one child it was irritating to be constantly plagued by shops and machines selling trinkets. It was also annoying that we were not allowed to exit to tower bridge and so I had to walk the (really) long the way round with a small child, it seems this was just to get us to walk through another gift shop again!

But now is the time to go, with no international tourists and no queues!
Read more",Jul 2021
UK,Tower of London,5.0,"Absolutely brilliant now the whole Tower is open; there is so much to see, It never disappoints. One welcome return are the Yeoman Warder guided tours which are a must. I had the privilege of joining hashtag Beefy 409 Scott Kelly's guided tour. He is a natural orator and really brought the history of the Tower to life. There was plenty of blood and gore, which thrilled the children present... but it was lovely to hear the story of Lady Jane Grey and get a sense of the pity of the place. We were all given homework to research Jane. I suspect there will be a fair amount of google searching going on as Scott brought a real sense of empathy to her story.

All credit to the rest of the Yeoman Wardens working at the Tower today who were nothing but kind, considerate and helpful. A fantastic day out.
Read more",Jul 2021
UK,Tower of London,4.0,Been really looking forward to this. Lots were not explained. Tour could not go ahead as it was raining but not explained why we were not allowed to listen to beefeater in the rain,Jul 2021
UK,Tower of London,5.0,"Thanks to the best looking Yeoman Warden (Scott Kelly) for the laughs, education, Ravens and “The Beefy Pose”
Absolutely brilliant day out, best of the London attractions by a rack!!",Jul 2021
UK,Tower of London,5.0,"Absolutely wonderful experience through and through, so much history to take in, David the Yeoman gave us the 45 minute tour, he was very clear with his speech and very educated on the history of the Tower, I even got to meet the lovely AJ Clark, after watching the TV programme Inside The Tower, to give a better knowledge of the Tower, history and the Yeoman, I just wanted to meet her, AJ is so lovely,
You do need comfy footwear as it is all cobbled and can be a little hard walking, make sure you have plenty of time to visit the Tower as there is so so much to see.
Would certainly visit again and again.
Good entry price too.
Read more",Jul 2021
UK,Tower of London,5.0,"first time we had visited , spent a great 5 hours here, tip is go for opening time, and straight to crown jewels display, no crowds then so you get to see them!! Yeoman guard tour is just fantastic!!!",Jul 2021
UK,Tower of London,5.0,"Absolutely brilliant the whole family (ranging from 5 to 33) thoroughly enjoyed our day here the Beefeater tour was greet definitely a must. Our Yeoman warder was Called Shaun he was very funny, great with the kids and the enthusiasm he displayed made the whole experience even better. The food available was really nice, a lot different to the other attractions in London and the price is OK. 3 of us ate for less than £20. Would highly recommend this as a day out. Only down side is the TripAdvisor website states 2-3 hours to experience it. You could do it in this if you are only walking through the various areas without paying much attention. We took 6 hours to see it all.",Jul 2021
UK,Tower of London,5.0,Fantastic visit to the Tower of London. Great for all ages. We have a teenager and 7 year old. Definitely recommend waiting to have the tour with the beefeaters. When you enter the site you will see a board for the next time. Definitely worth the money. We spent 3 hours at the site. Cafe on site or you could bring a picnic and have after you leave over looking the Thames. Lots of walking and stairs if you do have little ones or have mobility issues. If you are visiting the Tower not much close by in terms of other attractions apart from the Sky Garden which I highly recommend. You will need to book a slot for this too.,Jun 2021
UK,Tower of London,5.0,Amazing!! Such an interesting place! We found out so much information. We especially loved the beautiful ravens! They made us smile 😃 Definitely visiting again😀,Jun 2021
UK,Tower of London,5.0,"Excellent day well laid out, we were able to visit all attractions without queuing. Lots of interesting places to visit. We saw some filing taking place. Staff were friendly and helpful and we look forward to visiting again",Jun 2021
UK,Tower of London,5.0,"Had a fabulous day out with my 11 & 9 yr old daughters. Crowds were minimal as foreign tourists are obviously reduced in numbers & lots of schools were yet to break up.
Didn't queue for anything.
Had a fabulous Yeoman Warden's tour with J Mcdonald (I think!). Very knowledgeable & entertaining. Maintained my kids interest on a very hot day. Would definitely recommend.
A fantastic piece of history which is not to be missed.",Jul 2021
UK,Tower of London,5.0,"Fantastic day the tv didn’t do it justice snd met several of the yeoman waters off the tv who were all amazingly friendly and chatty especially the warder YW M Pryme who discussed Italy with my Italian wife
Brilliant day out well recommended, the Crown Jewels were amazing as was the whole experience",Jun 2021
UK,Tower of London,4.0,"Even as a londoner, it's a very interesting place to visit. To really get the true value of visiting the Tower of London, you should make sure to join the beefeater tour (free with standard tickets) that take place frequently. Understanding the real history behind so much of the Tower of London makes a huge difference to your experience. Our tour guide (the self proclaimed chubby William Shatner) was fantastically funny, inclusive and open to provide even more history than what is just part of the tour. The same goes in the crown jewels area, do spend time asking some of the helpers as they are happy to share interesting aspects that you might not be aware of just from walking around and reading the notes on the walls.
Read more",Jul 2021
UK,Tower of London,5.0,"This surely is a must see if you are visiting London. There is easily enough to see here to keep you occupied for most of a day. We took a Yeomans tour which I would recommend doing for their insight and knowledge of the place. Our guide said he hadn't taken a tour for 17 months due to Covid but you wouldn't know it as he knew how to entertain a crowd and was clearly very knowledgeable.
It's a wonderful time to go now - just after covid regulations have been lifted it's not too busy but everything was open. We didn't even have to queue to see the Crown Jewels which are worth the visit just on their own.",Jul 2021
UK,Tower of London,5.0,"Absolutely excellent!! You must do a tour - they are included in the price of the ticket and absolutely made out day!

Personally I would recommend arriving then doing the tour, it gives you a could basis of where everything is and background info.

Again - brilliant tour!",Jul 2021
UK,Tower of London,5.0,This is a must see when you visit London. lots to see and the beefeaters are lovely. it was lovely just to have a wander about on your own or you can take a guided tour. a great day out,Jul 2021
UK,Tower of London,5.0,Just a wonderful experience all round. From the engaging staff to the wonderful Crown Jewels. The cafe was exceptional and very reasonably priced. Delicious lunches and wonderful cakes. The staff in the cafe were pleasant and helpful. The ponchos came in very useful due to a monsoon in London. (Well worth the money good quality which saved our underwear) can’t wait to return.,Jul 2021
UK,Tower of London,5.0,"Writing a review as a recommendation if visiting. Me and my early bird 6 year old daughter got there for 9:30am. We walked around everything crowd free. It didn't get busy until half 11 so i recommend getting there early to avoid crowds. Everything is so fab and well laid out. The beefeaters who tour guild are nice and loud so you can hear well and are really funny as well as super knowledgeable, worth doing the guilded tour with them (free). Loads to see and do. Lots of walking though, up and down many steps. We did 13000 steps in 4 hours!",Jul 2021
UK,Tower of London,5.0,Excellent all round day - interesting and informative and Covid safe - Yeoman Warders are excellent really enjoyable.,Jul 2021
UK,Tower of London,5.0,Part of London’s heritage a great day out very affordable lots to see and lots for the kids to do food services and fees are very affordable and a good standard. Lots of beefeaters to have snaps with the kids. Downside lots of stairs. If you want gifts buy inside tower they are very good quality don’t but outside they are rip offs. Can of coke £2 ice lollies £3 enjoy a slice of English history you will enjoy it,Jun 2021
UK,Tower of London,5.0,"While visiting the Tower of London with friends, I was so excited to watch a soldier change his shift that I tripped over my trousers in embarrassment，I hurt my elbow and knee.

The staff called for first aid for me，And Yeoman Warder Scott Kelly was very patient and kindly to help me with the wound，he also showed us way patiently，I was very lucky to meet such kind man in London，The trip to London left me an unforgettable memory～Thank you very much～
在和朋友参观伦敦塔的时候，看到一个士兵换班，我太兴奋了，尴尬地绊了一下裤子，弄伤了胳膊肘和膝盖。

工作人员为我呼叫了急救，非常Yeoman Warder Scott Kelly 耐心和友好的帮助我的伤口，他也耐心地为我们指路，我很幸运在伦敦遇到这样的人，伦敦之旅留下了我难忘的记忆~非常感谢~
Read more",Jul 2021
UK,Tower of London,5.0,"Make sure you take the Yeoman Warder tour, our warder was Barry and he was very entertaining, it's a great way to quickly learn some of the history and stories related to the Tower. There is so much to see once the tour has finished, the crown jewels are stunning and we enjoyed exploring all the towers, battlements and the White Tower with the displays of armour. It is quite expensive to get in but we spent five hours there so it was worth the money.",Jul 2021
UK,Tower of London,5.0,"Lived in London most of my life and ashamed to say first time I’ve visited.
Had a guided tour by AJ, most informative and amusing.
Not really busy so had the chance to see everything and no queues.
Loved every minute of it",May 2021
UK,Tower of London,5.0,"When in London come on down to the Tower of London. Come and explore the vast wealth of history that is buried within the inner and outer walls. A must do is a Yeoman Warder tour. I would highly recommend having a tour with none other that Yeoman Warder Scott Kelly hashtag Beefy409. If you want blood, sweat, shock horror and gore and I mean gore then he is your Yeoman to give you it all.
Well worth it and then you can explore the rest of this Royal Hostorical Palace in your own leisure. You will get a glimpse of the Crown Jewels, see the Ravens and the guards. There is something for all ages. You can even have a photo with your favourite Yeoman Warder..",Jul 2021
UK,Tower of London,5.0,"Outstanding history, just would have liked more information on Guy Fawkes and his time at the tower only seemed to get a small information about him. All the staff were friendly and user friendly.",Jul 2021
UK,Tower of London,5.0,"Fantastic day. Went on the spur of the moment. Got tickets ok. And also not crowded, picked quiet day. Great guided tour by yeoman warder Scott Kelly.
Brilliant time.",Jul 2021
UK,Tower of London,4.0,"Overall I was very pleased with my visit to the tower. The staff were very friendly and the sights were beautiful. Lines weren't long and the food actually respectfully prices. The only thing I did find was sometimes the one way systems are too long, we got roped into one at the very start of the entrance and it didn't let us back out until halfway around the castle! Similarly, there are two gift shops in the actual tower but you cannot enter them unless you do the whole tour so I'd recommend just skipping those gift shops and going to the one on the pier just outside of the exit. There was a lot of interesting history but I would definitely avoid going on weekends so you actually have more time and space to read the signs.
Read more",Jul 2021
UK,Tower of London,4.0,"We visited today and had an okay time exploring this historically amazing place. We did feel more could be done to bring the tower to life, lots of huge rooms that are almost empty. This place has so much history, yet what’s on show and portrayed barely scratches the surface.

The staff weren’t particularly helpful, the team on the gate weren’t friendly and the guy serving ice creams by the white tower was a miserable so and so. He made it clear he hated his job.
Would I visit again, probably not.",Jun 2021
UK,Tower of London,5.0,I can’t believe we have never visited the Tower of London before. It was amazing experience. Can’t recommend enough!,Jul 2021
UK,Tower of London,5.0,"We all know the great Tower of London, if been as a child and again later in my 20's.
Everytime I come back it gets better and better, new medias have really helped bring history to life.",Jul 2021
UK,Tower of London,5.0,We really liked this tour. We arrived at 9am which meant we didn’t have to queue to see all the Crown Jewell’s or any of the other buildings inside. It was great and interesting. The Beefeaters Know their stuff!,Jul 2021
UK,Tower of London,5.0,"Excellent day of history and entertainment always something to see around the next corner, fantastic exhibits and very knowledgeable guides the warders are quick to please with an answer or a photo food is good in the cafe, can't go far wrong with this one, can be a long day so sensible shoues are a must",Jul 2021
UK,Tower of London,5.0,"Brilliant visit to the Tower on Sunday 11th July. Wonderfully friendly Beefeaters, excellent Grenadier Guardsmen (one of whom was my son!) and a really lovely lady in the Crown Jewels gallery (sorry I didn’t catch her name).
We had an in depth discussion on the pearls used in the making of the Imperial State crown. Really fascinating thank you!",Jul 2021
UK,Tower of London,5.0,"Because, if there is a benefit from covid, its that places are so quiet. It was unbelievable no queues for the Crown jewels and the ravens were all out happily hopping around not affected by the crowds. This is certainly the time for locals/UK residents to visit!",Jul 2021
UK,Tower of London,5.0,"We thoroughly enjoyed a few hours spent here. Very informative and it wasn’t too busy, so there was lots of room and time to have a good read of all the info. We thought audio guides were a bit steep at £5 each, so opted to read the information boards instead which were good. Recommend going earlier at 9 or 10. There were quite a few school groups around which made social distancing difficult in certain areas. Other than that it was perfect and the staff were all super friendly and full of knowledge to share:)",Jul 2021
UK,Tower of London,4.0,"When i did this tour with my family, i had an excellent time. We were able to see many years of history in this place. I recommend coming with time!",Jun 2021
UK,Tower of London,5.0,"It's been a long time since my last visit to the Tower and it felt immensely special to be there when there were so few other tourists about, time to linger in the rooms and read all the information without being jostled or feeling like you were in the way. But any time its a fantastic place to visit and certainly a half-day or more activity - we were there from 1pm til closing and didn't see everything.

A special thank you to the guide in the armoury who told even us history nerds thins we didn't know about jousting, destriers and the connection between Henry VIII and the moon landing.",Jul 2021
UK,Tower of London,5.0,"We revisited after 40 years and it was a perfect time to do it as there weren't too many others there. Last time we could hardly get to see the Crown Jewels, but this time we went round 5 times! The history was fascinating and I especially liked the Medieval Palace, where Henry V1 was murdered. We were there until closing time and a very pleasant Yeoman Warder showed us round while she locked up. At least we got out!",Jun 2021
UK,Tower of London,4.0,"My wife and I visited because we've never 'got around to it'. Wonderful experience, well worth making the time",Jul 2021
UK,Tower of London,5.0,"Most people have heard about the infamous Tower of London and its royal prisoners, beheadings etc. and even if you have no interest in history itself you must visit this site as the genuine item. It is larger than you imagine and there are multiple towers to explore and steep spiral staircases so not suitable for everyone. All the crown jewels are on display and much more. During Covid this is definitely the time to visit as exceptionally quiet and you can spend as much time as you choose viewing all the exhibits. With no queuing and leisurely exploring we needed 3 hours to see everything. Note the early closing though. Our tickets purchased directly on line were a bargain at £24 each.",Jul 2021
UK,Tower of London,4.0,"I lived in London for a decade and never visited and thing visiting an iconic building like the tower should be done in life - Its massive taking up 2- 4 hours of historical interest. Lots of steps i don't think those with accessibly issues would find it easy.
I learnt so much didn't know it was the coin place and practically a zoo at one time.",Jun 2021
UK,Tower of London,5.0,"The Crown Jewels are breathtaking to be sure! But I thoroughly enjoyed seeing the cannons and weapons they used during this period. The history is fascinating. You will be glad you visited this historical, iconic place! I was!!",Jul 2021
UK,Tower of London,5.0,"Excellent morning spent in the Tower and grounds made so much better because of the wonderful staff. Gareth, in particular gave us so much of his time to explain about the Crown Jewels and their providence. I cannot recommend this enough.",Jun 2021
UK,Tower of London,4.0,"Really enjoyed this day out. As English Heritage members it was nice to link the Tower with other local attractions.
The area is a lot bigger than I imagined and I would say to allow more than 2 hours for your visit.
Some areas would not be pushchair or wheelchair friendly as you can imagine...these buildings won't have lifts as I'm not sure they were invented in 1500s.
Cafe very expensive as you cam imagine. Not only because its London but also because its an attraction in London. I paid £15 for 2 coffees and 2 cakes. I mean the cakes were lovely! Staff in cafe very friendly.
Only thing that put a dampner on it for me was getting a scolding in the crown jewels exhibit. I didnt see any signs saying no photographs and as I was taking a picture of the queen's jewels I heard a booming voice behind me trying to get my attention and finally yelling at me 'no'.
I was embarrassed and actually had a moment when I left the building. I went round to check if there were signs and there was 1 small sign amongst other information saying no photographs.
I was stood in a que watching the guards so didn't see this sign. There was someone on the door letting us in in dribs and drabs so maybe they could mention something in future.
Had a really good day though and hope to revisit...where my camera would stay firmly in my.pocket, when I next visit her majesty's precious stones.
Read more",Jul 2021
UK,Tower of London,5.0,"As a London local it was 25 years since I last visited the Tower so the ticket price came as a bit of a shock! However COVID days suggested that this might be a good time and I was not disappointed.

As to the Tower itself, our trip speaks for itself: we arrived before 10.00 am and left at closing time. There was so much to see and it was all well exhibited and explained. The audio tour (an extra £4) was also well worth having. I imagine that the Crown Jewels is normally full to the brim with tourists whereas we were able to take our time and take several rides on the travelator.

The staff are friendly and helpful and clearly value working for such a national institution. If you fancy a trip to the Tower, now (July 2021) is an ideal time to go and avoid the tourist hordes. Be prepared to spend some time there in order to see all the various parts of the Tower (at least 4 hours I would have thought).

Unfortunately their online booking system was rubbish but the staff at the ticket office sorted things out. Make sure you get your Booking Reference number.
Read more",Jul 2021
UK,Tower of London,5.0,"Stunning. Literally a deep dive into the sometimes gruesome and occasionally absolutely scandalous history of the UK monarchy through the centuries. Every conceivable element of the fortress and it’s occupants is covered. Real active soldiers guard the Crown Jewels and the residences. The yeoman warders are on hand to answer your questions.
I cant explain how interesting it was.

The Crown Jewels are stunning and a must see.

Worth every penny.
Read more",Jun 2021
UK,Tower of London,5.0,Incredible. Walking around it’s hard to take in all of the history. Everyone around the site was helpful and really friendly. We were given some great little history lessons for lots of the guides in the rooms. Really excellent staff and wonderful place,Jun 2021
UK,Tower of London,5.0,"We went on a Sunday morning, easy to get in no queues, the staff are all very helpful and knowledgable. We paid for the audio guide which was great as it took you round a route and had more information than just reading in each exhibit. Such an interesting trip especially the Crown Jewels.",Jun 2021
UK,Tower of London,5.0,"A treasure trove of history surrounded by the modern world, the tower was the best part of my London trip.

I would recommend getting there for the opening of the the gates to see the royal guard and the beefeaters perform their ceremony, and on any trip there you need to go to the crown jewels as your first stop. I was lucky to get right in but the line does build up quickly.

The Fusiliers museums and white tower were both splendid with armours from the past
Read more",Jun 2021
UK,Tower of London,5.0,We joined some friends in visiting the Tower as we had never done it before. It was a good experience and great to learn all about such a historic building. The only disappointment is that we had to wear face masks but that was expected in a Covid-world. Would definitely recommend a visit though.,Jun 2021
