country,attraction,score,review,trip_date
UK,Tower of London,5.0,"Brilliant day out. Every member of staff was helpful friendly and obviously loved working there. The beefeaters are a wealth of information, there was so much to see, will go again",Nov 2021
UK,Tower of London,5.0,Loads of history all in one place. Great entertainment. Not overpriced. Definitely allow 3 or 4 hours to take it all in.,Nov 2021
UK,Tower of London,4.0,The beefeater tour with Gary was truly excellent. He managed to make everyone laugh but also teach interesting facts about this incredible place. The Crown Jewels and Tower of London building itself were the most interesting areas and unfortunately the Royal Mint building was closed for an unknown reason hence the dropping a mark.,Nov 2021
UK,Tower of London,5.0,"This took me right back to childhood and visiting here with my dad. I would recommend getting there early if you want to see the jewels as by lunchtime the queue was massive whereas a few hours earlier we were able to walk right in.
Give yourself a few hours to visit everything as the place is seeped in history with lots to see and it would be a shame to miss anything.
Some of the places to visit involve stairs and narrow spiral staircases so this is something to bear in mind if you don't like that kind of thing but you can walk all the way around the site if you walk up the walls.
We also had lunch in one of the on site cafes and that was lovely good service and great food
Definitely one of the highlight of our trip to London.
Read more",Aug 2021
UK,Tower of London,4.0,"Make sure you get a tour with a Beefeater they are very knowledgeable and know the history that touring the grounds on your own you would miss.
Beautiful grounds so old with the modern city in the background.
I would say 2 hours is enough time.
A cafe on site.
Visit the crown jewels.
I would recommend and return!",Nov 2021
UK,Tower of London,5.0,"We booked online and got our dates muddled and turned up a day early it was sorted easily with no fuss.
We joined Gary for the Beefeater tour and he was fantastic, enthusiastic, knowledgeable and funny. The queues on the day were non existent and getting around every area of interest was easy and hassle free.
We saw all the main exhibits, the Crown Jewels, the White Tower, the Bloody Tower and time to get photographs with the Ravens.
Well worth the money.
Read more",Nov 2021
UK,Tower of London,5.0,"We went on a Tuesday around 13:30, and it was so quiet! We went on the tour with our Beefeater, Clive. Clive was great, spoke clearly and loudly so all the group could hear, was full of interesting facts, and involved the crowd.
The whole experience was good fun for all ages, although I would say there are obviously a lot of stairs, so to be mindful of that.
Would definitely recommend.",Nov 2021
UK,Tower of London,5.0,"Beefeaters very knowledgable . Cut short due to rain but plenty to see in the towers, church. Will visit again. This was our 3rd visit",Oct 2021
UK,Tower of London,2.0,"Nearly £50 for one adult and one child. Admittedly, we went during the bank holiday, so our time was mostly spent in queues. The buildings are iconic, but once you get inside, the exhibits are of a poor quality and little effort to make history come alive. My advice would be to walk around the outside, and visit the Leeds Armouries, which is free to enter.",Oct 2021
UK,Tower of London,5.0,We've visited the Tower of London a couple of times before and always have a great day. There is so much to see and the information is very well put together. A great day for adults and children alike,Aug 2021
UK,Tower of London,5.0,"My wife and I thoroughly enjoyed our visit to the tower. We were lucky enough to be on the tour with Yeoman Warder Kelly AKA Beefy 409 who was absolutely brilliant! He was very informative and extremely funny, he had me in stitches a few times. He said he was actually quite new, but I would have thought he had been there for years, certainly a great addition to the team.

We got there quite early, so were fortunate enough to be able to see everything whilst it was still quite quiet. It's an amazing feeling stepping back in time and learning all the incredible history that the tower holds. Plus my personal highlight, getting to see the Ravens up close and personal; beautiful birds!
Read more",Oct 2021
UK,Tower of London,5.0,Used our london passes and went straight in. We arrived just as the yeoman tour was about to start. Our guide was Yeoman Warder Lawrence Watts. He was excellent and very informative and also very funny. I live this place,Oct 2021
UK,Tower of London,5.0,"This was a fantastic day out on its own!

Tip: Start immediately at the Crown Jewels as the queues get massive later.

The place is huge and there is so much to see, read and take in.

My husband and I arrived with our 6yr old in the October half term and used our Go City passes for entry which saved us a significant amount of money.

The famous sights including the Ravens, the Bloody Tower and Crown Jewels were fantastic and we were amazed that people actually lived on site!

Highly recommended trip!

Read more",Oct 2021
UK,Tower of London,3.0,£29.90 entrance ticket price. Really not worth the money. All rather dull. Queued for ages to see the Crown Jewels.,Oct 2021
UK,Tower of London,1.0,"We were very much looking forward to our visit as a fun and educational family day out. We were very disappointed in our visit due to the number of people there. We felt that, even taking Covid out of the equation, there were far too many people. We had not expected this, given that we had booked tickets online in advance. The website says that 'You can safely explore the history of this famous fortress, palace and prison' and all the attractions that were included in the ticket price. However, it was impossible to visit even close to everything, and certainly not safely, due to the volume of people - every tower / building etc had a queue. For the Crown Jewels in particular it was ridiculous. There was no way to social distance, no one controlling the numbers of people in any of the buildings. It ruined our experience. Given that we are still in a pandemic, the number of people was unacceptable. We arrived at 12 midday and had expected to stay until the closing time of 4.30pm. We left around 3pm as we found the crowds of people too stressful and overwhelming. We undertook a 45 minute Yeoman of the Guard tour at the start of our visit and whilst this was both informative and fun, it was again spoilt by the amount of people - it was difficult to hear the commentary. It would have been far more enjoyable and Covid friendly to have split the group into 2 or 3. There were plenty of Beefeaters around, so I think this would have been a manageable solution to improve people's experience. Also advertised for half term was 'Ghost Raiders' - a half term Halloween activity for the children - there was no mention or sign of this while we were there. I could not recommend that anyone visit this attraction during the school holidays. Such a pity when it could have been an amazing experience. I understand that venues are trying to recoup lost earnings, but it seems to me that the attitude of 'Historic Royal Palaces' stinks of greed and arrogance, having no consideration of their visitors' enjoyment or safety.
Read more",Oct 2021
UK,Tower of London,5.0,"We really enjoyed the information and gentle,enthusiastic delivery of warder Barry Stringer. He was superb in the chapel. Thank for your patience.",Oct 2021
UK,Tower of London,2.0,"We visited the Tower with 2 children during half term. I expected it to be busier than usual but was extremely disappointed to find it so crowded. We had booked online for 1 pm but went in early - cursory check. We had paid for an audio guide but such a long queue to get into shop, we didn't wait. It felt chaotic and disorganised - get as many people in as possible. We saw battlements and the white tower, unfortunately not the Crown jewels (queue went beyond the white tower). In time of Covid, I did not expect this. Signs saying to wear masks inside buildings but they were by far and away exception. Only one member of staff on battlements who did not appear to be controlling flow of people into tower. By far the worst experience I have had in a public situation since beginning of Covid guidelines. Value for money would have been good if we had been able to see more. However it turned out to be an expensive afternoon.
Read more",Oct 2021
UK,Tower of London,5.0,"Tower of London- I would suggest going as early as possible- we went when it opened and noticed it got busier as the day went on.I got and audio tour for my child and it made it so much more interesting - (ended up telling me facts) and engaging. As you don’t have to do it in a set order it was so pleasurable. Every member of staff we interacted , met were polite and had a smile.
We spoke three members of staff asking them questions each one of them had fantastic knowledge of the Tower of London. The cafe on site had a lovely selection of food for all. Highly recommend going to explore the Tower of London. It is definitely a day out .",Oct 2021
UK,Tower of London,3.0,"Nice, very busy during half term there was quite a que.
There is some confusion over the towers and would be good to hire out an audio for the tour which didn't come to mind when we booked. Need more than just a couple hours here as it could take most of your day seeing the history behind Tower of London. Great day out.",Oct 2021
UK,Tower of London,5.0,"An excellent family day out, so much history, would reccomend the audibility package to really make the day worthwhile if understanding of the historical events of the Tower is a priority. We had a 7, 10 and 13 years old and they all had a great time. Would suggest to book out the full day to really maximise the tru historical significance of such a landmark destination.",Oct 2021
UK,Tower of London,4.0,It was great visiting the Tower of London generally but sadly a bit too busy (being a school holiday) to see everything. But we will definitely be visiting again,Oct 2021
UK,Tower of London,5.0,"Great visit and interesting facts. Will be back for another visit. Too much to see in one day.
Well worth a visit and very interesting facts.",Oct 2021
UK,Tower of London,5.0,"There is so much history here, from the 11th century to today. Yeoman Warders are amazing - what a GREAT JOB! Their tour is excellent and included with admission - be sure to take the tour.

I became a member of Historic Royal Palaces to have more flexibility to go in whenever we wished during a recent trip to London. Membership is WORTH IT. Be sure to book directly.

Go in, enjoy watching the ravens (they truly take their jobs seriously and provide plenty of entertainment for their visitors), go see the Crown Jewels (WOW!) when there is no line, take plenty of time in the White Tower. The cafe is adequate should you need to grab tea/coffee/cake/light snack while you are there.

Wear comfortable shoes...old cobblestones are not forgiving should your choice of footwear err on the side of fashion vs. comfort and function. Enjoy this wonderful place!
Read more",Oct 2021
UK,Tower of London,5.0,"It was a last minute decision to visit the Tower of London before returning home from a weekend away. Booking online was easy and the tickets emailed to us straight away.

There’s a lot to do inside and it’s really informative, it was lovely to see the queens guards doing their marching outside the Crown Jewels area.

I’m glad we went but it is probably something I would only do once in my lifetime. But all in all it was a good day out
Read more",Aug 2021
UK,Tower of London,5.0,"Book the Beefeater tour, first class. Would definitely recommend it. Not hurried along and after the tour left to explore the tour.",Oct 2021
UK,Tower of London,5.0,Me and my family loved it! @Beefy409 aka Scott Kelly was amazing he was a great storyteller and we got a photo with him! When we go back we would love to have him as our beefeater tour guide so I would definitely recommend him to anyone who wants to go!,Oct 2021
UK,Tower of London,5.0,Well worth getting there early to miss the queues into the popular Crown Jewels exhibition and White Tower (although they were around 45 mins at peak time compared to 2 hours in pre Covid times). We paid £29.90 per adult and £14.90 for our 8 yr old and it was certainly worth the money as we were there for over 5 hours. The Yeoman/Beefeater tour was both amusing and informative (thank you to Barney) and would say that the White Tower is not to be missed for great exhibits and interactive games for children.,Oct 2021
UK,Tower of London,5.0,"Really interesting and informative tour of the Tower of London. The Beefeater, Scott Kelly, was so entertaining, funny and knowledgeable and I highly recommend this attraction for adults and children alike (especially if you like gruesome tales)",Oct 2021
UK,Tower of London,4.0,"Family with 14 & 12 year olds. Thoroughly enjoyed by us all, the stand out was definitely the yeoman warder tour which we joined on arrival. Perfectly pitched and informative tour which engaged and entertained us all, thanks Beefy#409!
As it was half term, long queues for everything, as you would expect (particularly the Crown Jewels exhibit which was almost an hour queue!)",Oct 2021
UK,Tower of London,5.0,"Legendary place. Had a fun few hours exploring. Even though it was half term, they are at about a third normal for fall, sad for them, but it meant by arriving at 9am we didn’t have to queue for a thing. Hope it picks up again when the world starts to get out more.",Oct 2021
UK,Tower of London,3.0,"As the title says, we're glad we went and experienced the Tower of London. But the entrance fees are just astronomical!",Oct 2021
UK,Tower of London,1.0,"Arrived 4 minutes (!) late with young kids and were not allowed in. A very disappointing experience for the whole family.

Not sure why they take timing so seriously (considering how bad and unpredictable the London traffic is). But thought I should leave the review to warn others, especially families with kids.",Oct 2021
UK,Tower of London,4.0,Had a lovely day out at The Tower of London with the family. Very easy to book the tickets online and not much of a queue to get in. Happy that there were concession and child ticket prices available. Lovely place to be on an autumn day. Can't wait for the next adventure!,Oct 2021
UK,Tower of London,4.0,"Came down from north for a day out in London, and was here before dinner on Brick Lane City Spice (which had amazing out of this world food!).

It was a very nice visit here, the tours of the grounds are spectacular and the history behind it is amazing! A very sweet sweet place to visit!",Oct 2021
UK,Tower of London,4.0,"Enjoyable visit to the Tower, however the lunch was a total rip off! Not much choice and we paid £33 for 1 child's portion of fish fingers and chips, 2 sausages with chips (they run out of mash by 2pm!), bowl of coleslaw, 1 small bottle of water and 1 small bottle of beer.",Oct 2021
UK,Tower of London,5.0,"Amazing. Loads to see and learn.

Take the beefeater initial tour as it brings everything together and helps you get your bearings.

Get there early for the crown jewels",Oct 2021
UK,Tower of London,4.0,"Very good time! The yeoman tour (I am so sorry, I cannot recall his name but it's the Scotsman #409 Yeoman guard) was absolutely incredible! A great storyteller and his ""we'll beheading this way"" joke slew me. Well done sir. Then we went through the white tower and I really enjoyed this historical tour. The fusiliers museum was surprisingly small, that being said it was enjoyable. The biggest let down was the Crown Jewels. The crowd control was dismal and the exhibits were quick to see. Felt like a bit of a let down in all truth. The white tower and prince's tower were far better in my opinion. But, and I can't believe I'm writing this, the best part was the cafe! Their cake selection is second to none, exceptional victoria sponge. If it weren't £30 to enter each time I'd be there for cake daily!
Read more",Oct 2021
UK,Tower of London,5.0,"I thought it was great, we had a yeoman warden called Scott Kelly who was great and very knowledgeable. Overall brilliant I thought. Would definitely return. Crown Jewels are ace as well",Oct 2021
UK,Tower of London,5.0,"I can't recommend the beefeater tour especially with beefy409 (on Facebook), it's a brutally detailed and endlessly entertaining and informative hour long tour you can't do without.",Oct 2021
UK,Tower of London,4.0,"Brilliant day out! Really enjoyed this, it was interesting. I loved seeing the crown Jewels, they really are stunning. I think it was worth the money we were there over three hours.",Oct 2021
UK,Tower of London,5.0,"All the history of England in one location. Make sure that you take the ""Beefeater's"" guided tour. He was a wealth of history information.",Oct 2021
UK,Tower of London,5.0,"We’ll worth the money - we spent just over 3 hours here yesterday & could have spent longer but had another attraction booked. Chris our tour Beefeater was amazing, funny & knowledgeable and an hour with him passed really quickly. Crown Jewels - able to get really close & admire the amazing crowns. Lots of steps & cobbles & my knees are complaining today - but it was so worth it. Lots of school groups yesterday, but still relatively quiet & able to see everything without queues - visit this autumn if you can.",Oct 2021
UK,Tower of London,5.0,"What more could you ask for, Beefeaters, sentries wearing bear skins, Crown Jewels and so much more
If your visiting and want historical England then a castle is a must on your trip.
There will be queues and bag searches but once through the gates you are transported back to yea olden times.
Book a tour with a Beefeater or take the audio tour to make the most of your visit
From torture chambers to Royal bedrooms there is so much to take in
Allow at least 2 hours",Oct 2021
UK,Tower of London,5.0,Wonderful attraction especially seeing the Crown Jewels. I was lucky to go on a lovely autumns day and with a lack of tourists could spend more time enjoying the displays. Anyone from the UK should take the opportunity to visit now with less crowds and more time to enjoy.,Oct 2021
UK,Tower of London,5.0,"Beefeater tour is a must if you visit. laurence was excellent full of knowledge and a great laugh, loved every minute of the tour",Oct 2021
UK,Tower of London,4.0,"A brilliant day out the beefeater tour is well worth it and as well as a great knowledge of history they have a great attitude to children asking relentless questions. We all had a brilliant time the only down side would be the price of admission which now means a typical family may not be able to visit, which I feel is a shame. But other than that a excellent day out you will not regret going.",Oct 2021
UK,Tower of London,5.0,As mentioned in a previous review. We took the in-laws here for a day out along side the british museum and they loved it!!!! a fantastic day out for the whole family.,Oct 2021
UK,Tower of London,5.0,Great visit here with teen and a 10 year old. We all loved it and spent quite a few hours exploring and admiring the jewels. Don’t bother with the cafe - lukewarm and expensive! Didn’t detract from the rest of the exhibits thankfully. Well worth reading the walls some fascinating yet terrifying insights to the history of the tower there. We took the hop on hop off bus out to the tower which took forever but was enjoyable as well as giving the feet a rest!,Oct 2021
UK,Tower of London,5.0,"Make sure you take the tour with the Yeoman- hilarious, educational and informative! The Crown Jewels are simply incredible and well laid out so you get a chance to get up nice and close and have a really good look at them. All exhibits were well laid out and accessible- probably the way day out we have ever had in London (nice and close to Sky Garden for dinner afterwards)",Oct 2021
UK,Tower of London,5.0,Young female guide called phoebe at the entrance to the crown jewels was very knowledgeable and able to answer all our questions including about the Krays being imprisoned there. Infact all members of staff were lovely. Just a shame we didn't have a lot of time as it was near closing time.,Oct 2021
UK,Tower of London,4.0,"Good experience but really wish we had stuck with the tour guide to appreciate the explanation and history.
Was great to see everything, ravens, crown jewels and the other important bits of history but I do feel like we may have missed something due to everyone raving how good it is, we just found it ok. I've marked it ""very good"" as I do appreciate the important history of the place and glad we did it. Entry price is fairly standard for attractions in London but don't mind paying since it needs a fair amount for the upkeep and staff.",Oct 2021
UK,Tower of London,5.0,"We had the best morning !!! Lawrence was our guide and he was just brilliant, engaging and funny, he included the children and adults making it accessible to all. He managed to relay a wealth of information and make us all laugh throughout. Honestly one of the best tours we have ever had. We would highly recommend it to all!",Oct 2021
UK,Tower of London,5.0,"Fabulous trip with my husband and his parents. Fir someone who doesn't really 'do' history i thoroughly enjoyed our few hours here.
Starting off with a tour by Yoemen Warder Andy M was a great bonus. I'd normally find these things drab but he made the 45 mins entertaining (think dad jokes and slightly un-PC, which we loved) and very informative. He finished off telling us both about the guards outside of the Crown Jewels and then about how he became a Warder...by the end we were all brimming with the British Pride that oozed from him.
After that a wander round the buildings and exhibits, plus a drink in the Armouries cafe (clean and spacious).
A thoroughly enjoyable visit.
Read more",Oct 2021
UK,Tower of London,4.0,A fantastic few hours having a look round and getting a live history lesson from a beefeater! A great time looking around at the food wasn’t to bad (tad pricey),Aug 2021
UK,Tower of London,5.0,"Feels odd doing a review for the Tower of London. You just simply must see it.
We had a great morning out here. £29.90 each is a bit pricy, but we got two for one by printing off a voucher from National Rail, showed our train ticket at the box office and hey presto, half price.
(You're welcome! :)

We started off as many do with a yeoman (beefeater) tour that were running every 30 mind. The tour was free and starts just by the entrance. We had the honour of being led around by Yeoman Paul who is a real entertainer full of knowledge and a great sense of humour.
He said we made his day by asking his name for a review. Nope, you made ours, mate.
The tour is a fantastic way to start off the visit as its only 45 minutes to an hour and really sets you up to explore the rest of this beautiful historic masterpiece yourself.
We finished the experience with a well earned trip to the Spoons opposite so really did experience the best of British that day. ;)
Read more",Oct 2021
UK,Tower of London,5.0,"Lawrence made the whole tour!!!
If you can get a tour by this guy I would suggest it!! He’s very interesting and makes the tour entertaining!

Really helps get a feel for the place!

You can tell he is honoured to be a Yeoman. It’s so lovely to see!

Great tour Lawrence!
Read more",Oct 2021
UK,Tower of London,5.0,"Just came from the Tower of London and was lucky to catch a yeoman warder tour by the name of Lawrence

He was absolutely brilliant and funny… so much knowledge and history from him, thought he handles to very large crowd brilliantly

The experience overall was fanatastic, dripped in gruesome history !

Highly recommended
Read more",Oct 2021
UK,Tower of London,5.0,"Me and my Mum visited the Tower of London on our most recent staycation in London. We were not disappointed. We’d booked in advance online and we got a souvenir book included in our ticket price.

We were expecting it to not last the majority of the day, but oh my goodness you definitely get your moneys worth. We arrived for the morning session at 11am and we didn’t leave the Tower of London until around 5pm. We stopped for some lunch in the restaurant which was lovely.

Take your time to look around all of the places within the tower grounds. The beefeaters know so much and are very knowledgeable so if you have any questions, do ask them!

The most interesting find for me was the fact that Anne Boleyn is buried inside one of the chapels. The chapel is right in front of the place where she was beheaded!!

You will learn so much - and remember it’s a whole day trip - not a quick excursion - so make sure you leave plenty of time to do it - and enjoy it!
Read more",Jul 2021
UK,Tower of London,4.0,"The tower and its artifacts are fascinating when you think of the history involved. However I found it to be a glorification of the monarchy, which I expected, and also war, which I didn't.
Looking at the tower's prisoners' graffiti while they were awaiting their fate was harrowing - despite knowing they'd been abandoned to their death, they still prayed to their gods. Blind faith, I suppose.
The crown jewels look as though they could fund a few food banks for a while!",Oct 2021
UK,Tower of London,5.0,"its best if you book on line to ensure entrance , and I suggest you join one of the beefeaters as you enter as they give a very entertaining yet informative tour at the start og the visit, The crown jewels are amazing",Oct 2021
